{
  "$schema": "ship.schema.json",
  "type": 21,
  "name": "Gecko",
  "model": "Models/gecko.gltf",
  "maxEnergy": 70,
  "maxSpeed": 30,
  "laserPower": 2,
  "missiles": 0,
  "bounty": 5.5,
  "targetRadius": 99,
  "canisters": 0,
  "killPoints": 0.33203125,
  "colour": "0xFF",
  "scannerColour": "0x3C",
  "flags": ["hostile", "pirate"]
}
