{
  "$schema": "ship.schema.json",
  "type": 11,
  "name": "Cobra Mk III",
  "model": "Models/cobra-mk3.gltf",
  "maxEnergy": 150,
  "maxSpeed": 28,
  "laserPower": 2,
  "missiles": 3,
  "bounty": 0.0,
  "targetRadius": 95,
  "canisters": 3,
  "killPoints": 0.9140625,
  "colour": "cyan",
  "scannerColour": "cyan",
  "flags": ["innocent", "escapePod"]
}
