{
  "$schema": "ship.schema.json",
  "type": 15,
  "name": "Rock hermit",
  "model": "Models/rock-hermit.gltf",
  "maxEnergy": 180,
  "maxSpeed": 30,
  "laserPower": 0,
  "missiles": 2,
  "bounty": 0.0,
  "targetRadius": 80,
  "canisters": 7,
  "killPoints": 0.33203125,
  "colour": "red",
  "scannerColour": "red",
  "flags": ["trader", "innocent", "escapePod"]
}
