{
  "$schema": "ship.schema.json",
  "type": 31,
  "name": "Constrictor",
  "model": "Models/constrictor.gltf",
  "maxEnergy": 252,
  "maxSpeed": 36,
  "laserPower": 6,
  "missiles": 4,
  "bounty": 0.0,
  "targetRadius": 65,
  "canisters": 3,
  "killPoints": 5.33203125,
  "colour": "cyan",
  "scannerColour": "cyan",
  "flags": ["hostile"]
}
