{
  "$schema": "ship.schema.json",
  "type": 18,
  "name": "Mamba",
  "model": "Models/mamba.gltf",
  "maxEnergy": 90,
  "maxSpeed": 30,
  "laserPower": 2,
  "missiles": 2,
  "bounty": 15.0,
  "targetRadius": 70,
  "canisters": 1,
  "killPoints": 0.5,
  "colour": "cyan",
  "scannerColour": "cyan",
  "flags": ["hostile", "pirate", "escapePod"]
}
